### ISSUE TITLE
why is mullvad accessing random domains?

### ISSUE THREAD

**Issue by tenee12** [mullvad/mullvadvpn-app#8361]
### Is it a bug?

- [x] I know this is an issue with the app, and contacting Mullvad support is not relevant.

### I have checked if others have reported this already

- [x] I have checked the issue tracker to see if others have reported similar issues.

### Current Behavior

08:35:59.767015 IP s1931387157.blix.com.51919 > debian.35782: UDP, length 231
08:35:59.767973 IP debian.35782 > s1931387157.blix.com.51919: UDP, length 151
^C
76 packets captured
76 packets received by filter
0 packets dropped by kernel
root@debian:~# ss -uapn | grep 35782
UNCONN 0      0            0.0.0.0:35782      0.0.0.0:*     users:(("mullvad-daemon",pid=865,fd=24)) 

### Expected Behavior

?

### Steps to Reproduce

tcpdump while mullvad is running 

### Failure Logs

```shell

```

**Comment by ghost** [comment]
is it some shadowsocks obfuscation?

**Comment by hulthe** [comment]
Blix is one of our providers, so I'm not surprised to see one of their domains pop up. I'd simply wager that you're connected to one of our relays hosted on Blix.

If you're still unsure, `mullvad status` can show you the IP that you're connected to. Compare that to the output of tcpdump.

Stay safe :]

**Comment by ghost** [comment]
> If you're still unsure, mullvad status can show you the IP that you're connected to. Compare that to the output of tcpdump.

I created this issue because it doesn't match the ip with the domain name

**Comment by hulthe** [comment]
> I created this issue because it doesn't match the ip with the domain name

A quick search of `s1931387157.blix.com` yields an IP that matches with one of our relays in Finland.
What makes you think that the IP doesn't match? What is the output of `mullvad status`?

**Comment by ghost** [comment]
i guess visible ip and domain its connecting to are different
```
root@debian:~# mullvad status
Connected
    Relay:                  fi-hel-wg-101
    Features:               Lockdown Mode, Quantum Resistance, Shadowsocks
    Visible location:       Finland, Helsinki. IPv4: 193.138.7.149
root@debian:~# tcpdump | grep blix
tcpdump: verbose output suppressed, use -v[v]... for full protocol decode
listening on ens18, link-type EN10MB (Ethernet), snapshot length 262144 bytes
09:03:10.164546 IP s1931387137.blix.com.51942 > debian.38352: UDP, length 311
```

```
root@debian:~# dig s1931387137.blix.com

; <<>> DiG 9.20.9-2-Debian <<>> s1931387137.blix.com
;; global options: +cmd
;; Got answer:
;; ->>HEADER<<- opcode: QUERY, status: NXDOMAIN, id: 36653
;; flags: qr rd ra; QUERY: 1, ANSWER: 0, AUTHORITY: 1, ADDITIONAL: 1

;; OPT PSEUDOSECTION:
; EDNS: version: 0, flags:; udp: 65494
;; QUESTION SECTION:
;s1931387137.blix.com.		IN	A

;; AUTHORITY SECTION:
blix.com.		60	IN	SOA	ns1.blix.com. blix.com. 2025061701 28800 7200 604800 60

;; Query time: 64 msec
;; SERVER: 127.0.0.53#53(127.0.0.53) (UDP)
;; WHEN: Mon Jun 23 09:04:57 UTC 2025
;; MSG SIZE  rcvd: 89

root@debian:~# dig +short s1931387137.blix.com

```

s 193.138.7.137

**Comment by hulthe** [comment]
My bad, I should have specified that you need `mullvad status --verbose` to see the entry IP.

```
⤷  : mullvad status --verbose
Connected
    Relay:                  fi-hel-wg-101 (193.138.7.137:31044/UDP)
```

**Comment by ghost** [comment]
now it does match but why and how is mullvad resolving it through DNS? just some local mechanism of resolving relay server based off domainname patter?
i can't resolve it using dig, idk how mullvad is doing it

is it due to working in shadowsocks mode?

**Comment by hulthe** [comment]
We don't resolve it through DNS. What you're seeing is `tcpdump` performing _reverse_ DNS lookups, i.e. taking IP addresses and resolving them as domain names. Pass the `-n` flag to `tcpdump` to make it stop.

**Comment by ghost** [comment]
ok i guess dns lookup's misses can be covered via reverse dns lookups

![Image](https://github.com/user-attachments/assets/772b157d-2435-4737-bc43-fe554bf56c9d)
(no dns records but the domain name is associated with the ip address)

**Comment by ghost** [comment]
theres still a weird bug lets say you reconnect and go in switch's status page to see open connections and number of packets thats being sent

i thought it couldve been a bug in router ui, then i went on a machine and run tcpdump
and you see this

```
root@debian:~# mullvad status --verbose
Connected
    Relay:                  fi-hel-wg-001 (185.204.1.203:51842/UDP)
    Features:               Lockdown Mode, Quantum Resistance, Shadowsocks
    Bridge type:            None
    Tunnel type:            WireGuard
    Tunnel interface:       wg0-mullvad
    Visible location:       Finland, Helsinki. IPv4: 185.77.218.10, IPv6: 2a0c:f040:0:2790::a01e
root@debian:~# mul^C

root@debian:~# tcpdump | grep 193
tcpdump: verbose output suppressed, use -v[v]... for full protocol decode
listening on ens18, link-type EN10MB (Ethernet), snapshot length 262144 bytes
18:52:45.193110 IP debian.37159 > 192.168.1.7.51288: UDP, length 416
18:52:45.296555 IP s1931387157.blix.com.51902 > debian.52025: UDP, length 203
18:52:46.019319 IP 192.168.1.7.51288 > debian.37159: UDP, length 80
^C648 packets captured
678 packets received by filter
0 packets dropped by kernel

root@debian:~# tcpdump | grep 185
tcpdump: verbose output suppressed, use -v[v]... for full protocol decode
listening on ens18, link-type EN10MB (Ethernet), snapshot length 262144 bytes
 IP host-185-204-1-203.creanova.org.51842 > debian.57321: UDP, length 151
 IP host-185-204-1-203.creanova.org.51842 > debian.57321: UDP, length 151
 IP host-185-204-1-203.creanova.org.51842 > debian.57321: UDP, length 263
IP debian.57321 > host-185-204-1-203.creanova.org.51842: UDP, length 391
 IP host-185-204-1-203.creanova.org.51842 > debian.57321: UDP, length 263
 IP debian.57321 > host-185-204-1-203.creanova.org.51842: UDP, length 503
 IP host-185-204-1-203.creanova.org.51842 > debian.57321: UDP, length 183
 IP debian.57321 > host-185-204-1-203.creanova.org.51842: UDP, length 151
 IP host-185-204-1-203.creanova.org.51842 > debian.57321: UDP, length 247
IP debian.57321 > host-185-204-1-203.creanova.org.51842: UDP, length 151
 IP debian.57321 > host-185-204-1-203.creanova.org.51842: UDP, length 343
 IP host-185-204-1-203.creanova.org.51842 > debian.57321: UDP, length 151
 IP debian.37159 > 192.168.1.7.51288: UDP, length 368
^C376 packets captured
569 packets received by filter
0 packets dropped by kernel
```


i tried using disconnect and connect again and reconnect too, it seems to keep both wg tunnels up for some weird ass reason

then i performed systemctl restart mullvad-daemon and it worked no more the 157 ip (blix)


i think there might be a bug related to relay switches where the previous connection might remain open

**Comment by hulthe** [comment]
That's no bug. It's <del>a space station</del> just a quirk of wireguard.

Wireguard is a connection-less protocol. That means that, when you `mullvad disconnect`, there's no closing handshake or graceful shutdown. We just stop sending packets to whatever relay you're connected to, and stop listening to response-packets.

```
root@debian:~# tcpdump | grep 193
tcpdump: verbose output suppressed, use -v[v]... for full protocol decode
listening on ens18, link-type EN10MB (Ethernet), snapshot length 262144 bytes
18:52:45.193110 IP debian.37159 > 192.168.1.7.51288: UDP, length 416
18:52:45.296555 IP s1931387157.blix.com.51902 > debian.52025: UDP, length 203
18:52:46.019319 IP 192.168.1.7.51288 > debian.37159: UDP, length 80
```
^ notice how there's no _outgoing_ packets. Only a single, incoming packet from the relay. That's just some remote endpoint that thinks you're still connected, and trying to communicate to you. It's normal, harmless, and will stop eventually.

**Comment by ghost** [comment]
> ^ notice how there's no outgoing packets

I clicked ctrl + c early, but let's slide with your explanation I'll see what's going on, i only posted this because I sat on the router interface for 20 minutes periodically refreshing it and it kept increasing packets count which made me suspect something weird
